{
  "$schema": "https://json-schema.org/draft/2020-12/schema",
  "$id": "https://voyager.nagi.fun/plugin.schema.json",
  "title": "Voyager plugin manifest",
  "description": "A declarative Voyager plugin (plugin.json). Hand-written to mirror validateManifest in src/features/plugins/manifest/validate.ts, which is the authority: this schema is editor tooling, not the gate. Run `bun run plugin:check <dir>` for the checks a schema cannot express (the site a plugin ships under, the primitives this build carries, translation completeness). Unknown top-level keys are ignored rather than rejected, exactly as the validator ignores them.",
  "type": "object",
  "required": [
    "id",
    "name",
    "version",
    "description",
    "author",
    "category",
    "license",
    "engine",
    "tier",
    "matches",
    "contributes"
  ],
  "properties": {
    "$schema": {
      "type": "string",
      "description": "This schema's URL, so editors validate the file as you type."
    },
    "id": {
      "type": "string",
      "minLength": 1,
      "description": "Globally unique, reverse-dotted (e.g. `voyager.claude-reading-width`)."
    },
    "name": { "type": "string", "minLength": 1, "description": "English display name." },
    "version": {
      "type": "string",
      "minLength": 1,
      "description": "Semver of the plugin itself (e.g. `1.2.0`)."
    },
    "description": {
      "type": "string",
      "minLength": 1,
      "description": "English one-liner shown in the popup."
    },
    "author": { "type": "string", "minLength": 1 },
    "category": {
      "type": "string",
      "minLength": 1,
      "description": "Classification. The known set is render-fix, theme, layout, readability, productivity, integration, other; any string is accepted so third parties are not boxed in.",
      "examples": [
        "render-fix",
        "theme",
        "layout",
        "readability",
        "productivity",
        "integration",
        "other"
      ]
    },
    "license": {
      "type": "string",
      "minLength": 1,
      "description": "SPDX expression (e.g. `MIT`, `GPL-3.0-or-later`, `Proprietary`)."
    },
    "homepage": { "type": "string", "description": "Optional URL documenting the plugin." },
    "engine": {
      "type": "string",
      "minLength": 1,
      "description": "Semver range the plugin needs of the host engine: `*`, an exact `x.y.z`, or `>=x.y.z`. A plugin that invokes a primitive must set a floor at or above that primitive's `sinceEngine`, so an older Voyager says \"update Voyager\" instead of reporting a missing handler.",
      "examples": [">=1.2.0", ">=1.3.0"]
    },
    "tier": {
      "type": "string",
      "enum": ["declarative", "scripted"],
      "description": "`declarative` ships only data (CSS + JSON) interpreted by the bundled engine. `scripted` is reserved for a later advanced tier; the v1 engine applies only its declarative contributions."
    },
    "matches": {
      "type": "array",
      "minItems": 1,
      "items": { "type": "string", "minLength": 1 },
      "description": "URL match patterns the plugin applies to. Every pattern must stay inside the matches of the site the plugin ships under (plan D18) — `plugin:check` enforces that; this schema cannot.",
      "examples": [["https://claude.ai/*"]]
    },
    "contributes": { "$ref": "#/$defs/contributions" },
    "theme": {
      "type": "object",
      "required": ["brand"],
      "properties": {
        "brand": {
          "$ref": "#/$defs/hexColor",
          "description": "Accent for Voyager's own UI on the matched site(s); overrides the site adapter's brandColor. Hex only — the value is concatenated into a CSS `color-mix(...)` expression."
        }
      },
      "description": "Optional brand accent contributed for the matched site(s)."
    },
    "format": {
      "const": 1,
      "description": "Manifest format major. Absent means 1; published host catalogs always carry it."
    },
    "requires": {
      "type": "object",
      "description": "What the plugin needs from the host beyond the engine range. A miss disables the plugin with a reason (needs-handler / needs-semantic) instead of hiding it.",
      "properties": {
        "handlers": {
          "type": "array",
          "maxItems": 50,
          "items": {
            "type": "string",
            "minLength": 1,
            "maxLength": 100,
            "pattern": "^[a-z][a-zA-Z0-9]{1,39}$"
          },
          "description": "Primitive names the plugin invokes. Declaring them is optional for handlers already named by a `native` op, and required for anything a primitive is expected to provide implicitly."
        },
        "semantic": {
          "type": "array",
          "maxItems": 50,
          "items": { "type": "string", "minLength": 1, "maxLength": 100 },
          "description": "Semantic selector keys the plugin expects its site adapter to define. See site.schema.json for the vocabulary."
        }
      }
    },
    "changelog": {
      "type": "string",
      "minLength": 1,
      "maxLength": 500,
      "description": "One line describing this version, shown in the popup. When set, every locale in `i18n` needs a translated `changelog` too."
    },
    "i18n": {
      "type": "object",
      "description": "Localized metadata keyed by app language code. `en` is not needed — the top-level fields are the English copy, and every field falls back to them individually. `plugin:check` requires name and description (plus changelog and every setting label, when present) for ar, es, fr, ja, ko, pt, ru, zh and zh_TW.",
      "additionalProperties": { "$ref": "#/$defs/localization" }
    }
  },
  "$defs": {
    "hexColor": {
      "type": "string",
      "pattern": "^#(?:[0-9a-fA-F]{3}|[0-9a-fA-F]{4}|[0-9a-fA-F]{6}|[0-9a-fA-F]{8})$",
      "description": "A strict hex literal (3, 4, 6 or 8 digits), e.g. `#d97757`.",
      "examples": ["#d97757"]
    },
    "contributions": {
      "type": "object",
      "description": "Everything the plugin adds to the page. New capabilities arrive as new keys here — a plugin never runs code of its own.",
      "properties": {
        "styles": {
          "type": "array",
          "items": { "$ref": "#/$defs/styleContribution" }
        },
        "domOps": {
          "type": "array",
          "maxItems": 500,
          "items": { "$ref": "#/$defs/domOperation" }
        },
        "settings": {
          "type": "object",
          "description": "User-configurable settings, rendered by the popup. A `{{key}}` placeholder in a DOM operation's value is replaced with the resolved setting.",
          "additionalProperties": { "$ref": "#/$defs/settingField" }
        }
      }
    },
    "styleContribution": {
      "description": "CSS injected as a <style> element. Authors write `{ \"file\": \"style.css\" }`; the build inlines it as `{ \"css\": \"…\" }`, which is the form published catalogs carry. Classes must be `gv-` prefixed, and neither `@import` nor an external `url()` is allowed (no remotely-hosted resources).",
      "anyOf": [
        {
          "type": "object",
          "required": ["file"],
          "properties": {
            "file": {
              "type": "string",
              "pattern": "\\.css$",
              "description": "Path to a .css file beside plugin.json. Relative, no `..`, no query or fragment."
            }
          }
        },
        {
          "type": "object",
          "required": ["css"],
          "properties": {
            "css": { "type": "string", "maxLength": 200000 },
            "source": {
              "type": "string",
              "description": "The style file the CSS was inlined from. Written by the build."
            }
          }
        }
      ]
    },
    "selectorRef": {
      "description": "Where an operation applies: a bare CSS selector string (sugar for `{\"kind\":\"css\"}`), an explicit css ref, or a semantic key the site adapter maps to a site-specific selector. Prefer semantic keys — a site redesign is then a one-file adapter fix.",
      "anyOf": [
        { "type": "string", "minLength": 1 },
        {
          "type": "object",
          "required": ["kind", "selector"],
          "properties": {
            "kind": { "const": "css" },
            "selector": { "type": "string", "minLength": 1 }
          }
        },
        {
          "type": "object",
          "required": ["kind", "key"],
          "properties": {
            "kind": { "const": "semantic" },
            "key": { "type": "string", "minLength": 1 }
          }
        }
      ]
    },
    "domOperation": {
      "description": "One reversible DOM operation interpreted by the bundled engine.",
      "oneOf": [
        {
          "type": "object",
          "title": "addClass",
          "required": ["op", "target", "className"],
          "properties": {
            "op": { "const": "addClass" },
            "target": { "$ref": "#/$defs/selectorRef" },
            "className": { "type": "string", "minLength": 1 }
          }
        },
        {
          "type": "object",
          "title": "setAttribute",
          "required": ["op", "target", "name", "value"],
          "properties": {
            "op": { "const": "setAttribute" },
            "target": { "$ref": "#/$defs/selectorRef" },
            "name": {
              "type": "string",
              "minLength": 1,
              "pattern": "^(?![oO][nN])",
              "description": "Event-handler attributes (on*) are rejected: they inject executable code."
            },
            "value": {
              "type": "string",
              "description": "javascript:, data: and vbscript: values are rejected for href, src, action, formaction and xlink:href."
            }
          }
        },
        {
          "type": "object",
          "title": "setStyle",
          "required": ["op", "target", "styles"],
          "properties": {
            "op": { "const": "setStyle" },
            "target": { "$ref": "#/$defs/selectorRef" },
            "styles": {
              "type": "object",
              "description": "CSS property → value. An external url() is rejected.",
              "additionalProperties": { "type": "string" }
            }
          }
        },
        {
          "type": "object",
          "title": "hide",
          "required": ["op", "target"],
          "properties": {
            "op": { "const": "hide" },
            "target": { "$ref": "#/$defs/selectorRef" }
          }
        },
        {
          "type": "object",
          "title": "native",
          "description": "Invoke a first-party primitive by name. `params` is configuration, never instructions; the primitive validates its own params. The engine floor must clear the primitive's sinceEngine — `plugin:check` enforces that.",
          "required": ["op", "handler"],
          "properties": {
            "op": { "const": "native" },
            "handler": {
              "type": "string",
              "pattern": "^[a-z][a-zA-Z0-9]{1,39}$",
              "description": "A primitive name from src/features/plugins/verbs/contracts.ts."
            },
            "params": {
              "type": "object",
              "description": "Plain JSON configuration: primitives, arrays and objects of those, at most 4 levels deep, 50 keys or entries per level and 2000 chars per string.",
              "additionalProperties": true
            }
          }
        }
      ]
    },
    "settingField": {
      "type": "object",
      "required": ["type", "label", "default"],
      "properties": {
        "type": { "type": "string", "enum": ["boolean", "number", "string", "color", "select"] },
        "label": {
          "type": "string",
          "minLength": 1,
          "description": "English label. Every locale needs a translation under `i18n.<locale>.settings.<key>.label`."
        },
        "default": { "type": ["boolean", "number", "string"] },
        "minLabel": {
          "type": "string",
          "minLength": 1,
          "maxLength": 500,
          "description": "Label for the low end of a number/range control."
        },
        "maxLabel": {
          "type": "string",
          "minLength": 1,
          "maxLength": 500,
          "description": "Label for the high end of a number/range control."
        },
        "min": { "type": "number" },
        "max": { "type": "number" },
        "options": {
          "type": "array",
          "description": "Choices for a `select` setting.",
          "items": {
            "type": "object",
            "required": ["value", "label"],
            "properties": {
              "value": { "type": "string" },
              "label": { "type": "string" }
            }
          }
        }
      }
    },
    "localization": {
      "type": "object",
      "description": "One locale's copy. Every field is optional and falls back to the English original on its own.",
      "properties": {
        "name": { "type": "string", "minLength": 1, "maxLength": 500 },
        "description": { "type": "string", "minLength": 1, "maxLength": 500 },
        "changelog": { "type": "string", "minLength": 1, "maxLength": 500 },
        "settings": {
          "type": "object",
          "description": "Setting key → localized labels.",
          "additionalProperties": {
            "type": "object",
            "properties": {
              "label": { "type": "string", "minLength": 1, "maxLength": 500 },
              "minLabel": { "type": "string", "minLength": 1, "maxLength": 500 },
              "maxLabel": { "type": "string", "minLength": 1, "maxLength": 500 }
            }
          }
        }
      }
    }
  }
}
