{
  "id": "voyager.claude-reading-width",
  "name": "Claude · Comfortable Reading Width",
  "version": "1.4.0",
  "description": "Widen Claude's conversation to one centered, adjustable column, with user and assistant messages aligned together.",
  "i18n": {
    "zh": {
      "name": "Claude · 舒适阅读宽度",
      "description": "将 Claude 的对话拓宽为居中、可调节的单栏，用户与助手的消息统一左对齐。",
      "settings": {
        "width": {
          "label": "阅读宽度（px）",
          "minLabel": "更窄",
          "maxLabel": "更宽"
        }
      }
    },
    "zh_TW": {
      "name": "Claude · 舒適閱讀寬度",
      "description": "將 Claude 的對話拓寬為置中、可調整的單欄，使用者與助理的訊息統一靠左對齊。",
      "settings": {
        "width": {
          "label": "閱讀寬度（px）",
          "minLabel": "更窄",
          "maxLabel": "更寬"
        }
      }
    },
    "ja": {
      "name": "Claude · 快適な読書幅",
      "description": "Claude の会話を中央寄せの調整可能な 1 カラムに広げ、ユーザーとアシスタントのメッセージを揃えて表示します。",
      "settings": {
        "width": {
          "label": "読書幅（px）",
          "minLabel": "狭く",
          "maxLabel": "広く"
        }
      }
    },
    "ko": {
      "name": "Claude · 편안한 읽기 너비",
      "description": "Claude의 대화를 가운데 정렬된 조절 가능한 단일 열로 넓히고, 사용자와 어시스턴트 메시지를 같은 정렬로 맞춥니다.",
      "settings": {
        "width": {
          "label": "읽기 너비(px)",
          "minLabel": "좁게",
          "maxLabel": "넓게"
        }
      }
    },
    "fr": {
      "name": "Claude · Largeur de lecture confortable",
      "description": "Élargit la conversation de Claude en une seule colonne centrée et ajustable, avec les messages de l'utilisateur et de l'assistant alignés ensemble.",
      "settings": {
        "width": {
          "label": "Largeur de lecture (px)",
          "minLabel": "Plus étroit",
          "maxLabel": "Plus large"
        }
      }
    },
    "es": {
      "name": "Claude · Ancho de lectura cómodo",
      "description": "Amplía la conversación de Claude en una sola columna centrada y ajustable, con los mensajes del usuario y del asistente alineados juntos.",
      "settings": {
        "width": {
          "label": "Ancho de lectura (px)",
          "minLabel": "Más estrecho",
          "maxLabel": "Más ancho"
        }
      }
    },
    "pt": {
      "name": "Claude · Largura de leitura confortável",
      "description": "Amplia a conversa do Claude em uma única coluna centralizada e ajustável, com as mensagens do usuário e do assistente alinhadas juntas.",
      "settings": {
        "width": {
          "label": "Largura de leitura (px)",
          "minLabel": "Mais estreito",
          "maxLabel": "Mais largo"
        }
      }
    },
    "ru": {
      "name": "Claude · Удобная ширина чтения",
      "description": "Расширяет диалог Claude до одной центрированной колонки с настраиваемой шириной, выравнивая сообщения пользователя и ассистента вместе.",
      "settings": {
        "width": {
          "label": "Ширина чтения (px)",
          "minLabel": "Уже",
          "maxLabel": "Шире"
        }
      }
    },
    "ar": {
      "name": "Claude · عرض قراءة مريح",
      "description": "يوسّع محادثة Claude إلى عمود واحد موسّط قابل للتعديل، مع محاذاة رسائل المستخدم والمساعد معًا.",
      "settings": {
        "width": {
          "label": "عرض القراءة (px)",
          "minLabel": "أضيق",
          "maxLabel": "أوسع"
        }
      }
    }
  },
  "author": "voyager-official",
  "category": "readability",
  "license": "MIT",
  "homepage": "https://github.com/Nagi-ovo/voyager/tree/main/src/features/plugins/catalog/plugins/claude-reading-width",
  "engine": ">=1.2.0",
  "tier": "declarative",
  "matches": ["https://claude.ai/*", "https://*.frame.claudeusercontent.com/*"],
  "contributes": {
    "settings": {
      "width": {
        "type": "number",
        "label": "Reading width (px)",
        "minLabel": "Narrower",
        "maxLabel": "Wider",
        "default": 768,
        "min": 600,
        "max": 1600
      }
    },
    "styles": [{ "file": "style.css" }],
    "domOps": [
      {
        "op": "addClass",
        "target": "body",
        "className": "gv-plugin-claude-readable"
      },
      {
        "op": "setStyle",
        "target": "body",
        "styles": { "--gv-plugin-reading-width": "{{width}}px" }
      }
    ]
  }
}
