{
  "$schema": "https://voyager.nagi.fun/plugin.schema.json",
  "id": "voyager.chatgpt-reading-width",
  "name": "ChatGPT · Comfortable Reading Width",
  "version": "1.2.2",
  "description": "Widen ChatGPT's conversation to one centered, adjustable column — drag the slider to fit your screen.",
  "i18n": {
    "zh": {
      "name": "ChatGPT · 舒适阅读宽度",
      "description": "将 ChatGPT 的对话拓宽为居中、可调节的单栏——拖动滑块即可适配你的屏幕。",
      "settings": {
        "width": {
          "label": "阅读宽度（px）",
          "minLabel": "更窄",
          "maxLabel": "更宽"
        },
        "centerConversation": {
          "label": "对话内容居中"
        }
      }
    },
    "zh_TW": {
      "name": "ChatGPT · 舒適閱讀寬度",
      "description": "將 ChatGPT 的對話拓寬為置中、可調整的單欄——拖動滑桿即可符合你的螢幕。",
      "settings": {
        "width": {
          "label": "閱讀寬度（px）",
          "minLabel": "更窄",
          "maxLabel": "更寬"
        },
        "centerConversation": {
          "label": "對話內容置中"
        }
      }
    },
    "ja": {
      "name": "ChatGPT · 快適な読書幅",
      "description": "ChatGPT の会話を中央寄せの調整可能な 1 カラムに広げます。スライダーをドラッグして画面に合わせられます。",
      "settings": {
        "width": {
          "label": "読書幅（px）",
          "minLabel": "狭く",
          "maxLabel": "広く"
        },
        "centerConversation": {
          "label": "会話内容を中央に配置"
        }
      }
    },
    "ko": {
      "name": "ChatGPT · 편안한 읽기 너비",
      "description": "ChatGPT의 대화를 가운데 정렬된 조절 가능한 단일 열로 넓힙니다. 슬라이더를 드래그해 화면에 맞추세요.",
      "settings": {
        "width": {
          "label": "읽기 너비(px)",
          "minLabel": "좁게",
          "maxLabel": "넓게"
        },
        "centerConversation": {
          "label": "대화 내용 가운데 정렬"
        }
      }
    },
    "fr": {
      "name": "ChatGPT · Largeur de lecture confortable",
      "description": "Élargit la conversation de ChatGPT en une seule colonne centrée et ajustable — faites glisser le curseur pour l'adapter à votre écran.",
      "settings": {
        "width": {
          "label": "Largeur de lecture (px)",
          "minLabel": "Plus étroit",
          "maxLabel": "Plus large"
        },
        "centerConversation": {
          "label": "Centrer le contenu de la conversation"
        }
      }
    },
    "es": {
      "name": "ChatGPT · Ancho de lectura cómodo",
      "description": "Amplía la conversación de ChatGPT en una sola columna centrada y ajustable: arrastra el control deslizante para ajustarla a tu pantalla.",
      "settings": {
        "width": {
          "label": "Ancho de lectura (px)",
          "minLabel": "Más estrecho",
          "maxLabel": "Más ancho"
        },
        "centerConversation": {
          "label": "Centrar el contenido de la conversación"
        }
      }
    },
    "pt": {
      "name": "ChatGPT · Largura de leitura confortável",
      "description": "Amplia a conversa do ChatGPT em uma única coluna centralizada e ajustável — arraste o controle deslizante para ajustar à sua tela.",
      "settings": {
        "width": {
          "label": "Largura de leitura (px)",
          "minLabel": "Mais estreito",
          "maxLabel": "Mais largo"
        },
        "centerConversation": {
          "label": "Centralizar o conteúdo da conversa"
        }
      }
    },
    "ru": {
      "name": "ChatGPT · Удобная ширина чтения",
      "description": "Расширяет диалог ChatGPT до одной центрированной колонки с настраиваемой шириной — перетащите ползунок под размер вашего экрана.",
      "settings": {
        "width": {
          "label": "Ширина чтения (px)",
          "minLabel": "Уже",
          "maxLabel": "Шире"
        },
        "centerConversation": {
          "label": "Центрировать содержимое диалога"
        }
      }
    },
    "ar": {
      "name": "ChatGPT · عرض قراءة مريح",
      "description": "يوسّع محادثة ChatGPT إلى عمود واحد موسّط قابل للتعديل — اسحب شريط التمرير لتلائم شاشتك.",
      "settings": {
        "width": {
          "label": "عرض القراءة (px)",
          "minLabel": "أضيق",
          "maxLabel": "أوسع"
        },
        "centerConversation": {
          "label": "توسيط محتوى المحادثة"
        }
      }
    }
  },
  "author": "voyager-official",
  "category": "readability",
  "license": "MIT",
  "homepage": "https://github.com/Nagi-ovo/voyager/tree/main/src/features/plugins/catalog/sites/chatgpt/plugins/reading-width",
  "engine": ">=1.2.0",
  "tier": "declarative",
  "matches": ["https://chatgpt.com/*", "https://chat.openai.com/*"],
  "contributes": {
    "settings": {
      "width": {
        "type": "number",
        "label": "Reading width (px)",
        "minLabel": "Narrower",
        "maxLabel": "Wider",
        "default": 768,
        "min": 600,
        "max": 1600
      },
      "centerConversation": {
        "type": "boolean",
        "label": "Center conversation content",
        "default": false
      }
    },
    "styles": [{ "file": "style.css" }],
    "domOps": [
      {
        "op": "addClass",
        "target": "body",
        "className": "gv-plugin-chatgpt-readable"
      },
      {
        "op": "setStyle",
        "target": "body",
        "styles": { "--gv-plugin-reading-width": "{{width}}px" }
      },
      {
        "op": "setAttribute",
        "target": "body",
        "name": "data-gv-center-conversation",
        "value": "{{centerConversation}}"
      }
    ]
  }
}
